{
  "schemaVersion": 1,
  "candidate": "clean-room-contract-skills-003",
  "track": "contract-plus-skills",
  "generatedBy": "GPT-5 Codex",
  "cleanRoom": true,
  "allowedInputs": [
    "benchmarks/component-fidelity/button/clean-room/prompt.md",
    "benchmarks/component-fidelity/button/clean-room/allowed-inputs.json",
    "benchmarks/component-fidelity/button/clean-room/candidate.schema.json",
    "README.md",
    "AGENTS.md",
    "DESIGN.md",
    ".design/AGENT.md",
    ".design/INDEX.md",
    ".design/components/ACTIONS.md",
    ".design/components/FORMS.md",
    ".design/components/DATA-DISPLAY.md",
    ".design/patterns/PAGES.md",
    ".design/verticals/web/BASE.md",
    ".design/verticals/web/APP.md",
    "templates/design/PROJECT.md",
    "templates/design/COMPONENTS.md",
    "templates/design/REFERENCES.md",
    "templates/design/COMPOSITION.json",
    "skills/design-system/SKILL.md",
    "skills/design-review/SKILL.md"
  ],
  "provenance": {
    "runId": "clean-room-contract-skills-003",
    "generatedAt": "2026-07-22T00:00:00-04:00",
    "model": "GPT-5 Codex",
    "operator": "OpenAI Codex",
    "targetAccess": false,
    "allowedInputFiles": [
      "benchmarks/component-fidelity/button/clean-room/prompt.md",
      "benchmarks/component-fidelity/button/clean-room/allowed-inputs.json",
      "benchmarks/component-fidelity/button/clean-room/candidate.schema.json",
      "README.md",
      "AGENTS.md",
      "DESIGN.md",
      ".design/AGENT.md",
      ".design/INDEX.md",
      ".design/components/ACTIONS.md",
      ".design/components/FORMS.md",
      ".design/components/DATA-DISPLAY.md",
      ".design/patterns/PAGES.md",
      ".design/verticals/web/BASE.md",
      ".design/verticals/web/APP.md",
      "templates/design/PROJECT.md",
      "templates/design/COMPONENTS.md",
      "templates/design/REFERENCES.md",
      "templates/design/COMPOSITION.json",
      "skills/design-system/SKILL.md",
      "skills/design-review/SKILL.md"
    ],
    "promptSha256": "e9a9519e595a6b3e2b951df7da3f2913543fb162028ee9c1242cf1bec7ac50b0",
    "allowedInputsSha256": "e6e5743bd13c2400446d6f5a48037a2c336203861c141c8c945f963adcc073d2",
    "cleanRoomAttestation": "Generated only from the contract-plus-skills allowed inputs; did not read target.json, scorer misses, benchmark output, or existing candidates."
  },
  "anatomy": [
    "button.root",
    "button.icon-slot",
    "button.label",
    "button.hint",
    "button.loading-indicator",
    "button.focus-ring"
  ],
  "tokens": {
    "height": 48,
    "paddingInline": 18,
    "gap": 10,
    "radius": 999,
    "background": "#9b4f32",
    "foreground": "#fffdf8",
    "border": "#7a3f2a",
    "shadow": "0 10px 24px rgba(67, 52, 38, 0.18)",
    "fontFamily": "Inter",
    "fontWeight": 800,
    "labelSize": 14,
    "hintSize": 11
  },
  "states": {
    "hover": {
      "background": "#7a3f2a",
      "translateY": -1,
      "shadow": "0 12px 28px rgba(67, 52, 38, 0.22)"
    },
    "focusVisible": {
      "outlineWidth": 2,
      "outlineColor": "#2b2723",
      "outlineOffset": 3
    },
    "loading": {
      "opacity": 0.92,
      "label": "Saving",
      "indicator": "spinner"
    },
    "disabled": {
      "background": "#ede3d5",
      "foreground": "#766e65",
      "cursor": "not-allowed"
    }
  },
  "content": {
    "label": "Publish contract",
    "hint": "Visible after review"
  }
}
